"commit id","commit date","commit message"
"4c09c0daa019c25bc50566e448ba31c3e33dddfe","2014-02-27 18:11:47-05:00","Update screenshots for new icon
"
"2396f185c73146f65ff7fae0134c2e50b32ee1ea","2014-02-27 21:29:50-05:00","forgot to update the About page when the app icon changed
Also fix the URL for the website now that it has a real one
"
"de909a70e541f451741c9131cbcf573f0c69237f","2014-02-27 21:30:10-05:00","Screenshots moved to the website repo
"
"1f100189ac328a4f50e31ed62176af60cbc60e92","2014-02-27 21:30:25-05:00","source file for the app icon
"
"b5c42bd249486c99244527de5ae8379597045735","2014-02-27 21:35:47-05:00","version code doesn't need to change apparently
"
"4ba85b55db4f9b98470f3d36826c4c8990c3598f","2014-02-27 22:07:04-05:00","ok, forget that, it does have to change, the store was yelling about
something else (what, I'm not sure, but I uploaded it again and it
worked the second time)
"
