"commit id","commit date","commit message"
"ae2414e3570e071e3f1da5786a4dde63f8410578","2013-02-24 21:54:42+00:00","Modified color scheme to make the blue color more visible.

Updated version information for the next upcoming release.
"
"2c57bf8105a7545341356287954a105df34c8822","2013-03-31 14:58:51+00:00","Added app icons with nicer 'round' corners for different resolutions (ldpi, mdpi, hdpi)

Modified manifest, so the app can be backup up with full system backups.

Prepared use of BackupManager by adding the backup api key to the manifest.
"
"02581c8176321ae1cecf5f3401b0db593625c2da","2013-03-31 15:13:53+00:00","Updated play store logo and app icons
"
"539f821ac40ea48210d7d8cbc43483fcaab7c002","2013-03-31 15:42:35+00:00","Added app icon for xhdpi density and added baseline icons again (Issue #18)
"
"88444e334fdf6a714527171c68ebaf36810c1bbb","2013-03-31 17:22:33+00:00","Implemented interactive details list (Issue #17)

Bugfix: Added missing Cursor.close() to PeriodicalDatabase.loadRawData()
"
"81ed57d70bd8afa45058d7d47ea6f0dac3f76363","2013-03-31 21:34:49+00:00","Updated screenshots for publishing.

Reworked layout to display focused calendar entries properly.

Updated color scheme to have more vivid 'blue' elements.

Extended help text for the interactive list feature  (Issue #17)
"
"b5949ac9b19fb3b51c28b948892ca082137be0b1","2013-03-31 21:35:25+00:00","Release 0.10
"
