"commit id","commit date","commit message"
"051bb2ebd8cf739071c64449a522f4f42c60ea61","2012-09-02 05:42:35-04:00","Add lang3 to master

EGit wouldn't stop bothering me about it. While less than ideal, for
putting into ver1.0.1, I think the users will live for now.
"
"b3e9be554e8c32de5f7ca1bb88a3a9667172b3ae","2012-09-02 06:30:30-04:00","Modify ImageDownloader to use LruCache

As mentioned in the official docs, Weak/SoftReferences are not a very
good idea anymore because of the much more aggressive garbage
collection. The recommendation is to use a LruCache, which I have
modified the class to use. The performance benefit is apparent, but
could still be better.
"
"9f340139d59109e42cd1b192d9478c2efa829c42","2012-09-02 06:37:15-04:00","Version bump to 1.0.2
"
